{
  "schema_version": "1.0",
  "ppt_ir_ref": "/private/tmp/pptsmith-task6.F1Rx5h/pptxgenjs/.ppt-work/contracts/ppt-ir.json",
  "style_contract_ref": "/private/tmp/pptsmith-task6.F1Rx5h/pptxgenjs/.ppt-work/contracts/style-contract.json",
  "component_registry_ref": "/Users/skillmelody/.openclaw/workspace/.worktrees/pptsmith-v2-closeout/skills/article-html-to-ppt/references/component-registry.json",
  "capability_report_ref": "/private/tmp/pptsmith-task6.F1Rx5h/pptxgenjs/.ppt-work/contracts/capability-report.json",
  "profile": "standard",
  "builder": {
    "requested": "pptxgenjs",
    "selected": "pptxgenjs",
    "version": "4.0.1",
    "selection_score": 0.775,
    "selection_reasons": [
      "BUILDER_USER_REQUEST_VALID"
    ],
    "candidates": [
      {
        "builder": "pptxgenjs",
        "available": true,
        "version": "4.0.1",
        "score": 0.775,
        "native_component_coverage": 1.0,
        "editable_core_coverage": 1.0,
        "fallback_count": 0,
        "reasons": [
          "BUILDER_CANDIDATE_SCORED"
        ],
        "errors": []
      }
    ],
    "warnings": [],
    "errors": []
  },
  "slides": [
    {
      "slide_id": "S01",
      "objects": []
    },
    {
      "slide_id": "S02",
      "objects": [
        {
          "slide_id": "S02",
          "object_id": "judgment-card",
          "component_type": "comparison_card",
          "preferred_route": "native_ppt",
          "selected_route": "native_ppt",
          "decision": "selected",
          "reason_codes": [],
          "editable_core": [
            "label",
            "claim",
            "evidence"
          ],
          "rasterized_parts": [],
          "svg_parts": [],
          "native_overlay_parts": [],
          "qa_checks": [
            "COLOR_CONTRACT",
            "TEXT_OVERFLOW"
          ],
          "fallback_chain": []
        }
      ]
    },
    {
      "slide_id": "S03",
      "objects": [
        {
          "slide_id": "S03",
          "object_id": "evidence-coverage",
          "component_type": "metric_card",
          "preferred_route": "native_ppt",
          "selected_route": "native_ppt",
          "decision": "selected",
          "reason_codes": [],
          "editable_core": [
            "number",
            "label",
            "trend",
            "source_note"
          ],
          "rasterized_parts": [],
          "svg_parts": [],
          "native_overlay_parts": [],
          "qa_checks": [
            "COLOR_CONTRACT",
            "FONT_MINIMUM"
          ],
          "fallback_chain": []
        },
        {
          "slide_id": "S03",
          "object_id": "evidence-builders",
          "component_type": "metric_card",
          "preferred_route": "native_ppt",
          "selected_route": "native_ppt",
          "decision": "selected",
          "reason_codes": [],
          "editable_core": [
            "number",
            "label",
            "trend",
            "source_note"
          ],
          "rasterized_parts": [],
          "svg_parts": [],
          "native_overlay_parts": [],
          "qa_checks": [
            "COLOR_CONTRACT",
            "FONT_MINIMUM"
          ],
          "fallback_chain": []
        }
      ]
    },
    {
      "slide_id": "S04",
      "objects": [
        {
          "slide_id": "S04",
          "object_id": "acceptance-table",
          "component_type": "native_table",
          "preferred_route": "native_table",
          "selected_route": "native_table",
          "decision": "selected",
          "reason_codes": [],
          "editable_core": [
            "headers",
            "cells",
            "source_note"
          ],
          "rasterized_parts": [],
          "svg_parts": [],
          "native_overlay_parts": [],
          "qa_checks": [
            "TABLE_NATIVE",
            "TEXT_OVERFLOW",
            "COLOR_CONTRACT",
            "FONT_MINIMUM"
          ],
          "fallback_chain": []
        }
      ]
    },
    {
      "slide_id": "S05",
      "objects": [
        {
          "slide_id": "S05",
          "object_id": "coverage-chart",
          "component_type": "bar_chart",
          "preferred_route": "native_chart",
          "selected_route": "native_chart",
          "decision": "selected",
          "reason_codes": [],
          "editable_core": [
            "data",
            "labels",
            "source_note"
          ],
          "rasterized_parts": [],
          "svg_parts": [],
          "native_overlay_parts": [],
          "qa_checks": [
            "CHART_NATIVE",
            "COLOR_CONTRACT"
          ],
          "fallback_chain": []
        }
      ]
    },
    {
      "slide_id": "S06",
      "objects": [
        {
          "slide_id": "S06",
          "object_id": "acceptance-process",
          "component_type": "process_flow",
          "preferred_route": "native_diagram",
          "selected_route": "native_diagram",
          "decision": "selected",
          "reason_codes": [],
          "editable_core": [
            "nodes",
            "labels"
          ],
          "rasterized_parts": [],
          "svg_parts": [],
          "native_overlay_parts": [],
          "qa_checks": [
            "DIAGRAM_MAIN_PATH"
          ],
          "fallback_chain": [
            "hybrid_overlay",
            "svg_component"
          ]
        }
      ]
    },
    {
      "slide_id": "S07",
      "objects": [
        {
          "slide_id": "S07",
          "object_id": "comparison-semantics",
          "component_type": "comparison_card",
          "preferred_route": "native_ppt",
          "selected_route": "native_ppt",
          "decision": "selected",
          "reason_codes": [],
          "editable_core": [
            "label",
            "claim",
            "evidence"
          ],
          "rasterized_parts": [],
          "svg_parts": [],
          "native_overlay_parts": [],
          "qa_checks": [
            "COLOR_CONTRACT",
            "TEXT_OVERFLOW"
          ],
          "fallback_chain": []
        },
        {
          "slide_id": "S07",
          "object_id": "comparison-truth",
          "component_type": "comparison_card",
          "preferred_route": "native_ppt",
          "selected_route": "native_ppt",
          "decision": "selected",
          "reason_codes": [],
          "editable_core": [
            "label",
            "claim",
            "evidence"
          ],
          "rasterized_parts": [],
          "svg_parts": [],
          "native_overlay_parts": [],
          "qa_checks": [
            "COLOR_CONTRACT",
            "TEXT_OVERFLOW"
          ],
          "fallback_chain": []
        }
      ]
    },
    {
      "slide_id": "S08",
      "objects": [
        {
          "slide_id": "S08",
          "object_id": "implementation-plan",
          "component_type": "comparison_card",
          "preferred_route": "native_ppt",
          "selected_route": "native_ppt",
          "decision": "selected",
          "reason_codes": [],
          "editable_core": [
            "label",
            "claim",
            "evidence"
          ],
          "rasterized_parts": [],
          "svg_parts": [],
          "native_overlay_parts": [],
          "qa_checks": [
            "COLOR_CONTRACT",
            "TEXT_OVERFLOW"
          ],
          "fallback_chain": []
        }
      ]
    },
    {
      "slide_id": "S09",
      "objects": []
    }
  ],
  "summary": {
    "total_objects": 9,
    "fallback_count": 0,
    "unsupported_count": 0,
    "risk_codes": []
  }
}
